{
  "endpoint_name": "customer_balances",
  "bigquery_table": "visma_customer_balances",
  "primary_key": "customer.internalId",
  "source": "erp_rest",
  "enabled": true,
  "api_method": "get_customer_balances",
  "api_endpoint": "/v1/customer/balance",
  "pagination_profile": "finance_page_number",
  "modified_field": null,
  "merge_type": "upsert",
  "sync_pattern": "full_refresh_upsert",
  "validation_fields": [
    "customer.internalId"
  ],
  "notes": "Found 100 row(s) via discover_erp_endpoints.py. Key chosen from a sample of 100 row(s); the full ingest run is what proves it. Stored raw for later Dataform mapping."
}
