{
  "endpoint_name": "branches",
  "bigquery_table": "visma_branches",
  "primary_key": "number",
  "source": "erp_rest",
  "api_method": "get_branches",
  "api_endpoint": "/v1/branch",
  "pagination_profile": "none",
  "modified_field": "lastModifiedDateTime",
  "merge_type": "upsert",
  "sync_pattern": "incremental_upsert",
  "validation_fields": [
    "number",
    "name",
    "branchId",
    "isActive",
    "lastModifiedDateTime"
  ],
  "notes": "DataMart normalizer parity vs ERP (scripts/normalizer_parity.py, 2026-09-29, after correcting wrong-domain values): 5 of 9 fields equal on the single branch, zero wrong values; the rest do not exist on DataMart's root.",
  "datamart": {
    "ready": false,
    "tenant_overrides": {
      "33f319b9-4d57-11ee-960c-025417856183": false
    },
    "query_file": "config/queries/branch.graphql",
    "type_name": "Branch",
    "cursor_field": "updatedInDataMartDateTime",
    "id_field": "id",
    "company_filter": true,
    "join_normalizer": "normalize_branch",
    "fallback_source": "erp_rest",
    "root_field": "branches",
    "compare_excludes": [
      "corporateId",
      "lastModifiedDateTime",
      "organizationId",
      "vatRegistrationId"
    ]
  },
  "default_query": {
    "expandAddress": "true",
    "expandContact": "true",
    "expandCurrency": "true",
    "expandVatZone": "true",
    "expandLedger": "true",
    "expandIndustryCode": "true",
    "expandDeliveryAddress": "true",
    "expandDeliveryContact": "true",
    "expandDefaultCountry": "true",
    "expandBankSettings": "true"
  }
}
