{
  "endpoint_name": "customer_invoices",
  "bigquery_table": "visma_customer_invoices",
  "primary_key": "referenceNumber",
  "source": "erp_rest",
  "api_method": "get_customer_invoices",
  "api_endpoint": "/v1/customerinvoice",
  "pagination_profile": "finance_page_number",
  "modified_field": "lastModifiedDateTime",
  "merge_type": "upsert",
  "sync_pattern": "incremental_upsert",
  "validation_fields": [
    "referenceNumber",
    "documentType",
    "status",
    "documentDate",
    "currencyId",
    "amount",
    "balance",
    "lastModifiedDateTime"
  ],
  "datamart": {
    "ready": false,
    "query_file": "config/queries/customer_invoice.graphql",
    "cursor_field": "updatedInDataMartDateTime",
    "id_field": "id",
    "company_filter": true,
    "fallback_source": "erp_rest",
    "tenant_overrides": {
      "33f319b9-4d57-11ee-960c-025417856183": false
    }
  },
  "tier": 1,
  "open_set": true,
  "default_query": {
    "expandApplications": "true",
    "expandDunningInformation": "true",
    "expandAttachments": "true",
    "expandTaxDetails": "true",
    "expandInvoiceAddress": "true"
  }
}
