{
  "endpoint_name": "organizations",
  "bigquery_table": "visma_organizations",
  "primary_key": "organizationCd",
  "source": "erp_rest",
  "api_method": "get_organizations",
  "api_endpoint": "/v1/organization",
  "pagination_profile": "none",
  "modified_field": "lastModifiedDateTime",
  "merge_type": "upsert",
  "sync_pattern": "incremental_upsert",
  "validation_fields": [
    "organizationCd",
    "name",
    "organizationType",
    "baseCurrency",
    "ledger.id",
    "lastModifiedDateTime"
  ],
  "datamart": {
    "ready": false,
    "query_file": "config/queries/organization.graphql",
    "cursor_field": "updatedInDataMartDateTime",
    "id_field": "id",
    "company_filter": true,
    "fallback_source": "erp_rest",
    "tenant_overrides": {
      "33f319b9-4d57-11ee-960c-025417856183": false
    }
  },
  "default_query": {
    "expandBranches": "true",
    "expandBankSettings": "true"
  }
}
