{
  "endpoint_name": "discounts",
  "bigquery_table": "visma_discounts",
  "primary_key": [
    "discountCode",
    "series"
  ],
  "source": "erp_rest",
  "enabled": true,
  "api_method": "get_discounts",
  "api_endpoint": "/v2/discount",
  "pagination_profile": "finance_page_number",
  "modified_field": "lastModifiedDateTime",
  "merge_type": "upsert",
  "sync_pattern": "incremental_upsert",
  "validation_fields": [
    "discountCode",
    "series"
  ],
  "notes": "Found 129 row(s) via discover_erp_endpoints.py. Key chosen from a sample of 100 row(s); the full ingest run is what proves it. Stored raw for later Dataform mapping. Key set by hand: a sample cannot show it."
}
