{
  "endpoint_name": "earning_types",
  "bigquery_table": "visma_earning_types",
  "primary_key": "code",
  "source": "erp_rest",
  "api_method": "get_earning_types",
  "api_endpoint": "/v1/earningtype",
  "pagination_profile": "numbertoread_skip",
  "modified_field": null,
  "merge_type": "upsert",
  "sync_pattern": "full_refresh_upsert",
  "validation_fields": [
    "code",
    "description",
    "isActive",
    "isBillable",
    "isOvertime",
    "overtimeMultiplier"
  ],
  "datamart": {
    "ready": false,
    "type_name": "EarningType",
    "query_file": "config/queries/earning_type.graphql",
    "cursor_field": "updatedInDataMartDateTime",
    "id_field": "id",
    "company_filter": true,
    "join_normalizer": "normalize_earning_type",
    "fallback_source": "erp_rest",
    "tenant_overrides": {
      "33f319b9-4d57-11ee-960c-025417856183": false
    }
  }
}
