{
  "endpoint_name": "dm_states",
  "bigquery_table": "visma_dm_states",
  "primary_key": "id",
  "source": "datamart_graphql",
  "enabled": true,
  "api_method": "datamart.states",
  "modified_field": "updatedInDataMartDateTime",
  "merge_type": "upsert",
  "sync_pattern": "incremental_upsert",
  "validation_fields": [
    "id",
    "companyId",
    "updatedInDataMartDateTime"
  ],
  "notes": "Raw DataMart `states` (State), stored untouched for later Dataform mapping. No join_normalizer: every DataMart field is kept, unlike the lossy ERP-shaped shadow block some ERP endpoints carry. Deleted rows are included (deletedDatabaseRecord=true). Needs VSV2_AQUATIQ_DATAMART_COMPANY_ID.",
  "datamart": {
    "ready": true,
    "query_file": "config/queries/dm_states.graphql",
    "root_field": "states",
    "type_name": "State",
    "cursor_field": "updatedInDataMartDateTime",
    "id_field": "id",
    "company_filter": true,
    "fallback_source": "datamart_graphql"
  }
}
