{
  "endpoint_name": "customer_payment_methods",
  "bigquery_table": "visma_customer_payment_methods",
  "primary_key": [
    "customerId"
  ],
  "source": "erp_rest",
  "api_method": "get_customer_payment_methods",
  "api_endpoint": "/v1/customerpaymentmethod",
  "pagination_profile": "finance_page_number",
  "modified_field": null,
  "merge_type": "upsert",
  "sync_pattern": "full_refresh_upsert",
  "validation_fields": [
    "customerId",
    "paymentMethods"
  ],
  "datamart": {
    "ready": false,
    "type_name": "CustomerPaymentMethod",
    "query_file": "config/queries/customer_payment_method.graphql",
    "cursor_field": "updatedInDataMartDateTime",
    "id_field": "id",
    "company_filter": true,
    "fallback_source": "erp_rest",
    "join_normalizer": "normalize_customer_payment_method",
    "tenant_overrides": {
      "33f319b9-4d57-11ee-960c-025417856183": false
    }
  }
}
