{
  "endpoint_name": "discount_codes",
  "bigquery_table": "visma_discount_codes",
  "primary_key": "discountCode",
  "source": "erp_rest",
  "api_method": "get_discount_codes",
  "api_endpoint": "/v2/discountCode",
  "pagination_profile": "finance_page_number",
  "modified_field": "lastModifiedDateTime",
  "merge_type": "upsert",
  "sync_pattern": "incremental_upsert",
  "validation_fields": [
    "discountCode",
    "description",
    "discountType",
    "manual",
    "createdDateTime",
    "lastModifiedDateTime"
  ],
  "datamart": {
    "ready": false,
    "type_name": "DiscountCode",
    "query_file": "config/queries/discount_code.graphql",
    "cursor_field": "updatedInDataMartDateTime",
    "id_field": "id",
    "company_filter": true,
    "join_normalizer": "normalize_discount_code",
    "fallback_source": "erp_rest",
    "tenant_overrides": {
      "33f319b9-4d57-11ee-960c-025417856183": false
    }
  }
}
